{
  "schemaVersion": 1,
  "engine": "jsxgraph",
  "title": "Matrix als Transformation",
  "caption": "Ziehe a und d: Das Einheitsquadrat wird durch A mit b=0,5 und c=0 zu einem Parallelogramm.",
  "boundingbox": [-2, 7, 7, -2],
  "sliders": [
    { "name": "a", "label": "a", "range": [0.5, 3], "value": 1.5, "step": 0.1 },
    { "name": "d", "label": "d", "range": [0.5, 3], "value": 1.5, "step": 0.1 }
  ],
  "objects": [
    { "kind": "polygon", "points": [[0, 0], [1, 0], [1, 1], [0, 1]], "color": "#5b5a53" },
    { "kind": "polygon", "points": [[0, 0], ["a", 0], ["a+0.5", "d"], [0.5, "d"]], "color": "#294bd6" },
    { "kind": "text", "at": [0, -1], "text": "det(A) = {a*d-0.5*0}", "color": "#294bd6" }
  ],
  "checkpoint": {
    "prompt": "Setze a = 2 und d = 2. Welchen Wert hat det(A) — und damit den Flächeninhalt des Parallelogramms?",
    "input": "numeric",
    "expected": 4,
    "tolerance": 1e-6,
    "hints": ["A = [[a, 0,5], [0, d]] ist eine obere Dreiecksmatrix: det(A) = a·d − b·c."],
    "typicalErrors": [
      { "match": 3.5, "feedback": "det(A) = a·d − b·c mit b = 0,5 und c = 0 — der Korrekturterm fällt weg, weil c = 0." },
      { "match": 5, "feedback": "(a + 0,5)·d misst die äußere Breite, nicht den Flächeninhalt — die Scherung ändert die Fläche nicht." }
    ]
  }
}
