{
  "schemaVersion": 1,
  "engine": "jsxgraph",
  "title": "Chunking mit Überlappung",
  "caption": "Ziehe Chunk-Größe c und Überlappung o: Du siehst, wie sich die Anzahl der Textabschnitte verändert.",
  "boundingbox": [-1, 4, 12, -1],
  "sliders": [
    { "name": "c", "label": "c", "range": [2, 6], "value": 4, "step": 0.1 },
    { "name": "o", "label": "o", "range": [0.1, 1], "value": 0.5, "step": 0.1 }
  ],
  "objects": [
    { "kind": "polygon", "points": [[0, 0], ["c", 0], ["c", 0.8], [0, 0.8]], "color": "#294bd6" },
    { "kind": "polygon", "points": [["c-o", 1], ["2*c-o", 1], ["2*c", 1.8], ["c", 1.8]], "color": "#16713a" },
    { "kind": "polygon", "points": [["2*c-2*o", 2], ["3*c-2*o", 2], ["3*c-o", 2.8], ["2*c-o", 2.8]], "color": "#9c4b00" },
    { "kind": "text", "at": [0, -0.5], "text": "Chunks = {floor(10/(c-o)-0.0001)+1}", "color": "#294bd6" }
  ]
}
